{
  "id": "al-eizariya-listening-walk",
  "title": "مشي الإصغاء: طبقات المكان قبل الصورة",
  "place": "العيزرية — تجربة أولية مغلقة",
  "promise": "نفهم طبقة واحدة من المكان عبر صوت محلي وتفصيل عمراني، من دون ادعاء أن كل نقطة مفتوحة أو أن المسار جاهز للجمهور.",
  "audience": ["طلاب الإعلام الرقمي", "باحثون محليون", "زوار بدعوة مسبقة"],
  "steward": "يحتاج إلى منسق محلي وصاحب معرفة يوافقان على الصيغة قبل الاختبار.",
  "duration": "يحدد بعد المعاينة؛ لا يُعلن زمن ثابت حاليًا.",
  "capacity": "مجموعة صغيرة جدًا بعد موافقة المضيفين.",
  "steps": [
    "جلسة تمهيدية تشرح حدود التصوير والخصوصية والسلوك.",
    "الاستماع إلى قصة أو شرح من صاحب معرفة محلي.",
    "قراءة تفصيل عمراني من المجال العام دون دخول ملكية خاصة.",
    "تسجيل ملاحظة الزائر وملاحظة المضيف قبل الإغلاق."
  ],
  "notIncluded": [
    "لا تشمل دخول قبر أو كنيسة أو مسجد دون إذن الجهة المسؤولة.",
    "لا تشمل تصوير أشخاص أو بيوت أو أطفال دون موافقة.",
    "لا تشمل حجزًا أو دفعًا أو وعدًا بفتح موقع.",
    "لا تُستخدم كإثبات أن العيزرية تملك مسارًا سياحيًا جاهزًا."
  ],
  "safety": [
    "تحديد نقطة تجمع آمنة بعد المعاينة.",
    "إيقاف التجربة عند ازدحام أو تغير وصول أو اعتراض محلي.",
    "تسجيل خطة انسحاب وبديل غير ميداني.",
    "لا يصعد أي مشارك درجًا أو يدخل نقطة حساسة قبل وصف العائق والموافقة."
  ],
  "accessibility": [
    "الإتاحة غير مثبتة؛ لا يُقدّم وعد شامل.",
    "ينتج بديل صوتي/رقمي لمن لا يستطيع الحركة أو الدخول.",
    "تُختبر المعلومات قبل الزيارة مع أشخاص ذوي احتياجات وصول مختلفة."
  ],
  "communityBenefit": "يحدد بعد الاتفاق: أجر صاحب المعرفة أو المنسق، حق مراجعة المادة، وحدود استخدام الصوت والصورة، وأي إحالة تجارية واضحة.",
  "consentStatus": "not_started",
  "status": "concept",
  "source": {
    "kind": "repository",
    "label": "خارطة التنفيذ العميقة لـ SENSE؛ النموذج تصميم مقترح يحتاج موافقة واختبارًا.",
    "url": "https://github.com/Solvanix/urban-sense-core/blob/main/docs/strategy/SENSE-DEEP-EXECUTION-ROADMAP-AR.md",
    "accessedAt": "2026-09-26",
    "independence": "secondary",
    "evidenceNote": "هذه بطاقة تشغيلية استنتاجية وليست إعلان تجربة متاحة."
  },
  "lastReviewed": "2026-09-26",
  "nextTest": "تحديد ثلاثة أصحاب مصلحة محليين، ثم مراجعة الوعد والحدود قبل أي تصوير أو دعوة."
}
